Username,Tweet,Hashtags,clean_tweet,polarity,subjectivity,sentiment
"Ray Ankrum, Sr. Ed.D Ω",Empowering Workers: The Fight for Fair Wages and Rights #WorkersRights #MinimumWage #UnionSupport #FairPay #HealthcareReform #ChildcareCrisis #HousingAffordability #ClimateJobs #SustainableEnergy #SocialJustice,"#WorkersRights, #MinimumWage, #UnionSupport, #FairPay, #HealthcareReform, #ChildcareCrisis, #HousingAffordability, #ClimateJobs, #SustainableEnergy, #SocialJustice",empowering workers fight fair wages rights workersrights minimumwage unionsupport fairpay healthcarereform childcarecrisis housingaffordability climatejobs sustainableenergy socialjustice,0.7,0.9,Positive
The Doc,"In this podcast I discuss why health insurance deductibles are a diabolically evil strategy private insurers deploy. Patients and their docs must be vocal! ⁣
⁣
Full podcast now available on all platforms.⁣
⁣
Let’s get it!  ⁣
⁣ #healthinsurersarethedevil #healthcarereform","#healthinsurersarethedevil, #healthcarereform",podcast discuss health insurance deductibles diabolically evil strategy private insurers deploy patients docs must vocal full podcast available platforms lets get healthinsurersarethedevil healthcarereform,-0.0625,0.58125,Negative
Abby Brody,The solution is already here. We don’t need another reform. We need a revolution.  #EducationReform #HealthcareReform,"#EducationReform, #HealthcareReform",solution already dont need another reform need revolution educationreform healthcarereform,0.0,0.0,Neutral
iRemedy Healthcare,"We’re not running out of medicine.
We’re running out of honesty.

The U.S. has the supply—just not the access.

iRemedy is fixing that with AI, transparency, and direct procurement.  Read The End of Us:  https:// #TheEndOfUs #iRemedy #HealthcareReform","#TheEndOfUs, #iRemedy, #HealthcareReform",running medicine running honesty supplyjust access iremedy fixing transparency direct procurement read end theendofus iremedy healthcarereform,0.1,0.4,Positive
"Ray Ankrum, Sr. Ed.D Ω",Obesity Epidemic: The $160 Billion Crisis and Its Solutions #ObesityCrisis #HealthcareReform #HealthInnovation #HIMSS #HERS #WellnessJourney #PublicHealth #HealthyLiving #SuperBowlAd #SystemicChange,"#ObesityCrisis, #HealthcareReform, #HealthInnovation, #HIMSS, #HERS, #WellnessJourney, #PublicHealth, #HealthyLiving, #SuperBowlAd, #SystemicChange",obesity epidemic billion crisis solutions obesitycrisis healthcarereform healthinnovation himss wellnessjourney publichealth healthyliving superbowlad systemicchange,0.0,0.0,Neutral
Frugal Finance,Healthcare Help Hacks  https:// ss-shop.html … Frugal Fitness  https:// ss.html … #Healthcare #HealthcareSystemFacts #HealthcareInnovation #HealthcareReform #FrugalFitness #HealthInsurance,"#Healthcare, #HealthcareSystemFacts, #HealthcareInnovation, #HealthcareReform, #FrugalFitness, #HealthInsurance",healthcare help hacks ssshophtml frugal fitness sshtml healthcare healthcaresystemfacts healthcareinnovation healthcarereform frugalfitness healthinsurance,0.0,0.0,Neutral
Dae Y. Lee," Medicare waste alert! PBMs are inflating drug costs while silencing competition, costing taxpayers billions. We need  @doge  and  @elonmusk  to audit these practices and put an end to the waste within  #MedicarePartD  and  #MedicareAdvantage .  #HealthCareReform #PBMs #MedicareWaste","#MedicarePartD, #MedicareAdvantage, #HealthCareReform, #PBMs, #MedicareWaste",medicare waste alert pbms inflating drug costs silencing competition costing taxpayers billions need audit practices put end waste within medicarepartd medicareadvantage healthcarereform pbms medicarewaste,-0.2,0.0,Negative
Jeremy Au 区汉辉,Therapist Burnout: The Dark Side of Online Therapy #TherapistBurnout #OnlineTherapy #BetterHelp #MentalHealthCrisis #EthicalTherapy #AIandTherapy #MentalHealthAwareness #TherapyIndustry #HealthcareReform #PatientCare,"#TherapistBurnout, #OnlineTherapy, #BetterHelp, #MentalHealthCrisis, #EthicalTherapy, #AIandTherapy, #MentalHealthAwareness, #TherapyIndustry, #HealthcareReform, #PatientCare",therapist burnout dark side online therapy therapistburnout onlinetherapy betterhelp mentalhealthcrisis ethicaltherapy aiandtherapy mentalhealthawareness therapyindustry healthcarereform patientcare,-0.15,0.4,Negative
The Doc,"Insurance deductibles are a huge problem - a shady play by private health insurers to juice up their profits on the backs of patients and their docs. We must all be vocal. ⁣
⁣
Full podcast now available on all platforms.⁣
⁣
Let’s get it!   ⁣
⁣ #healthcarereform",#healthcarereform,insurance deductibles huge problem shady play private health insurers juice profits backs patients docs must vocal full podcast available platforms lets get healthcarereform,0.18,0.5700000000000001,Positive
Pune Mirror,"""Strict Action Will Be Taken Against Those Responsible for Deenanath Mangeshkar Hospital Tragedy"" - MoS Murlidhar Mohol
  #DeenanathMangeshkarHospital #MurlidharMohol #StrictAction #Pune #HospitalTragedy #HealthcareReform #JusticeForVictims #HealthMinistry #PuneNews","#DeenanathMangeshkarHospital, #MurlidharMohol, #StrictAction, #Pune, #HospitalTragedy, #HealthcareReform, #JusticeForVictims, #HealthMinistry, #PuneNews",strict action taken responsible deenanath mangeshkar hospital tragedy mos murlidhar mohol deenanathmangeshkarhospital murlidharmohol strictaction pune hospitaltragedy healthcarereform justiceforvictims healthministry punenews,0.15,0.325,Positive
National Health Executive,The RCP has called for outpatient care reform in the UK government's 10-Year Health Plan.  This move has also been welcomed by the NHS Confederation  More  https:// alls-outpatient-care-reform?utm_source=twitter&utm_medium=organic&utm_campaign=social_share … @NHSConfed #HealthcareReform #NHS #OutpatientCare,"#HealthcareReform, #NHS, #OutpatientCare",rcp called outpatient care reform governments year health plan move also welcomed nhs confederation allsoutpatientcarereformutmsourcetwitterutmmediumorganicutmcampaignsocialshare healthcarereform nhs outpatientcare,0.0,0.0,Neutral
vartha 24,"#HealthMission ,  #SocialWelfare ,  #AccessibleHealth ,  #HealthUpgradation ,  #MedicalAwareness ,  #CommunityHealth ,  #DurgHospital ,  #QualityHealthcare ,  #HealthProtection ,  #HealthcareReform ,","#HealthMission, #SocialWelfare, #AccessibleHealth, #HealthUpgradation, #MedicalAwareness, #CommunityHealth, #DurgHospital, #QualityHealthcare, #HealthProtection, #HealthcareReform",healthmission socialwelfare accessiblehealth healthupgradation medicalawareness communityhealth durghospital qualityhealthcare healthprotection healthcarereform,0.0,0.0,Neutral
NCQA,"#NCQA 's recommendations for the Trump Administration outline a vision for evolving  #QualityMeasurement  to support patient-driven, cost-effective, integrated care. Read our full recommendations here:  https:// #HealthCareReform #HealthCareInnovation","#NCQA, #QualityMeasurement, #HealthCareReform, #HealthCareInnovation",ncqa recommendations trump administration outline vision evolving qualitymeasurement support patientdriven costeffective integrated care read full recommendations healthcarereform healthcareinnovation,0.35,0.55,Positive
KidneyDAO," It’s 2025 and patients still don’t own their data, can’t access early detection, and wait years for innovation.
KidneyDAO is here to change that—one project, one community vote, one patient at a time.
Join us.  #DeSci #KidneyDAO #HealthcareReform","#DeSci, #KidneyDAO, #HealthcareReform",patients still dont data cant access early detection wait years innovation kidneydao change thatone project one community vote one patient time join desci kidneydao healthcarereform,0.1,0.3,Positive
The Doc,"In this podcast I discuss why health insurance deductibles are a diabolically evil strategy private insurers deploy. Patients and their docs must be vocal! ⁣
⁣
Full podcast now available on all platforms.⁣
⁣
Let’s get it!  ⁣
⁣ #healthinsurersarethedevil #healthcarereform","#healthinsurersarethedevil, #healthcarereform",podcast discuss health insurance deductibles diabolically evil strategy private insurers deploy patients docs must vocal full podcast available platforms lets get healthinsurersarethedevil healthcarereform,-0.0625,0.58125,Negative
SASpine,Wow! I really can’t believe a nurse did this to my patient?  #drcyr #saspine #healthcare #healthcarereform #nurseproblems #healthinsurance #healthinsurancestruggles #ORlife #spinehealth #spinesurgery,"#drcyr, #saspine, #healthcare, #healthcarereform, #nurseproblems, #healthinsurance, #healthinsurancestruggles, #ORlife, #spinehealth, #spinesurgery",wow really cant believe nurse patient drcyr saspine healthcare healthcarereform nurseproblems healthinsurance healthinsurancestruggles orlife spinehealth spinesurgery,0.15,0.6,Positive
BIGRICHBEAT$THE TOPICRICH ASHANTI!,"https:// os … Turn your video into viral clips with AI instantly!

Big shifts in the pharma industry ahead!  Discover how companies are returning to the U.S. for a safer, prouder future.   Watch now!  #Pharma #MadeInAmerica #AmericanPride #HealthcareReform","#Pharma, #MadeInAmerica, #AmericanPride, #HealthcareReform",turn video viral clips instantly big shifts pharma industry ahead discover companies returning safer prouder future watch pharma madeinamerica americanpride healthcarereform,0.0,0.1125,Neutral
ACRheumDC,"Embracing the first move towards prior authorization reforms!   At ACR, we're not stopping here. We're dedicated to cutting down on paperwork and amplifying patient access to essential meds. More on the proposed changes  https:// ogy/20250226/acr-cheers-positive-first-step-in-reforming-prior-authorization-for-medicare … #HealthcareReform #PatientAccess","#HealthcareReform, #PatientAccess",embracing first move towards prior authorization reforms acr stopping dedicated cutting paperwork amplifying patient access essential meds proposed changes ogyacrcheerspositivefirststepinreformingpriorauthorizationformedicare healthcarereform patientaccess,-0.0875,0.3833333333333333,Negative
P.M.C,"Doctors in Pakistan face challenges due to inadequate salaries.
 Despite their crucial role in healthcare, many struggle with financial insecurity, leading to brain drain & dissatisfaction. Competitive pay & better working conditions are urgent needs.

  #HealthcareReform",#HealthcareReform,doctors pakistan face challenges due inadequate salaries despite crucial role healthcare many struggle financial insecurity leading brain drain dissatisfaction competitive pay better working conditions urgent needs healthcarereform,0.175,0.475,Positive
Eyup Yilmaz,Healthcare reforms being debated could have major impacts on access and affordability. It's crucial to stay informed about potential changes and how they affect us all.  #HealthcareReform #PublicHealth #PolicyDebate,"#HealthcareReform, #PublicHealth, #PolicyDebate",healthcare reforms debated could major impacts access affordability crucial stay informed potential changes affect healthcarereform publichealth policydebate,0.0208333333333333,0.8333333333333334,Positive
HI4E.Org MarkShuster,"(DAILY SIGNAL) - ""For All Its Flaws, American Health Care Gets a Lot Right."" #HealthcareReform #AffordableHealthInsurance #HealthcareOptions #AffordableHealthcare #HealthcareSpending #MedicareForAll #SocializedMedicine #UniversalHealthcare #HI4E","#HealthcareReform, #AffordableHealthInsurance, #HealthcareOptions, #AffordableHealthcare, #HealthcareSpending, #MedicareForAll, #SocializedMedicine, #UniversalHealthcare, #HI4E",daily signal flaws american health care gets lot right healthcarereform affordablehealthinsurance healthcareoptions affordablehealthcare healthcarespending medicareforall socializedmedicine universalhealthcare hie,0.0952380952380952,0.1785714285714285,Positive
My Longevity Experiment,Is Modern Medicine America's 3rd Leading Cause of Death? #ModernMedicine #HealthcareReform #MedicalError #ArtificialIntelligence #HealthStatistics #HarvardStudy #HealthcareInnovation #MortalityRates #BigData #FutureOfMedicine,"#ModernMedicine, #HealthcareReform, #MedicalError, #ArtificialIntelligence, #HealthStatistics, #HarvardStudy, #HealthcareInnovation, #MortalityRates, #BigData, #FutureOfMedicine",modern medicine americas leading cause death modernmedicine healthcarereform medicalerror artificialintelligence healthstatistics harvardstudy healthcareinnovation mortalityrates bigdata futureofmedicine,0.2,0.3,Positive
The Jesus Gospel,Growing Support for Montana's Path to U.S. Statehood #MontanaStatehood #HealthcareReform #Politics #USA #CommunityVoice #ChangeIsComing #Montana #Alberta #Empowerment #GrassrootsMovement,"#MontanaStatehood, #HealthcareReform, #Politics, #USA, #CommunityVoice, #ChangeIsComing, #Montana, #Alberta, #Empowerment, #GrassrootsMovement",growing support montanas path statehood montanastatehood healthcarereform politics usa communityvoice changeiscoming montana alberta empowerment grassrootsmovement,0.0,0.0,Neutral
IL Chiropractic Soc.,Legislative Session Update: Crucial Bills Fail to Progress #LegislativeUpdate #HealthCareReform #ChiropracticCare #InsuranceDiscrimination #BillsInSession #GovernmentAffairs #PolicyMatters #StudentAthleteHealth #Advocacy #PublicHealth,"#LegislativeUpdate, #HealthCareReform, #ChiropracticCare, #InsuranceDiscrimination, #BillsInSession, #GovernmentAffairs, #PolicyMatters, #StudentAthleteHealth, #Advocacy, #PublicHealth",legislative session update crucial bills fail progress legislativeupdate healthcarereform chiropracticcare insurancediscrimination billsinsession governmentaffairs policymatters studentathletehealth advocacy publichealth,-0.25,0.65,Negative
National Health Executive,"New GPs hired to improve healthcare  The government has recruited 1,503 new GPs to improve patient access and reduce waiting times. More timely care for everyone!  Read more  https:// 1500-new-gps-recruited?utm_source=twitter&utm_medium=organic&utm_campaign=social_share … @DHSCgovuk #NHS #GPRecruitment #HealthcareReform #PlanForChange","#NHS, #GPRecruitment, #HealthcareReform, #PlanForChange",new gps hired improve healthcare government recruited new gps improve patient access reduce waiting times timely care everyone read newgpsrecruitedutmsourcetwitterutmmediumorganicutmcampaignsocialshare nhs gprecruitment healthcarereform planforchange,0.1363636363636363,0.4545454545454545,Positive
Colourful,"The UK government will abolish NHS England, bringing it back under direct control to cut bureaucracy and refocus on frontline care. Critics warn of disruption, while supporters say it will streamline services.  #NHS #HealthcareReform #UKPolitics","#NHS, #HealthcareReform, #UKPolitics",government abolish nhs england bringing back direct control cut bureaucracy refocus frontline care critics warn disruption supporters say streamline services nhs healthcarereform ukpolitics,0.05,0.2,Positive
vartha 24,"#HealthReforms ,  #EconomicImpact ,  #HospitalEmployees ,  #FutureOfJobs ,  #AmericanHealthcare ,  #TrumpAdministration ,  #HealthSectorCrisis ,  #HealthcareReform ,  #Obamacare ,  #PrivateHealthcare ,  #MedicalJobLoss ,  #HealthcareIndustry ,","#HealthReforms, #EconomicImpact, #HospitalEmployees, #FutureOfJobs, #AmericanHealthcare, #TrumpAdministration, #HealthSectorCrisis, #HealthcareReform, #Obamacare, #PrivateHealthcare, #MedicalJobLoss, #HealthcareIndustry",healthreforms economicimpact hospitalemployees futureofjobs americanhealthcare trumpadministration healthsectorcrisis healthcarereform obamacare privatehealthcare medicaljobloss healthcareindustry,0.0,0.0,Neutral
Melanie Hayward RNC SCPHN SN RNT FHEA FRSA She/her," Just published!   

My latest article in the  @BJNursing   explores the crisis of corridor care & its impact on nursing & patient safety  We all have a role in advocating for better conditions and support

  #Nursing #PatientSafety #HealthcareReform","#Nursing, #PatientSafety, #HealthcareReform",published latest article explores crisis corridor care impact nursing patient safety role advocating better conditions support nursing patientsafety healthcarereform,0.5,0.7,Positive
Bloom Pakistan,KP Legalizes Cannabis for Medical and Industrial Purposes #BloomPakistan #KPGovt #CannabisLegalization #KPKNews #MedicalCannabis #IndustrialHemp #KPUpdates #CannabisPakistan #LegalCannabis #HealthcareReform Full story: https:// annabis-for-medical-and-industrial-purposes/ …,"#BloomPakistan, #KPGovt, #CannabisLegalization, #KPKNews, #MedicalCannabis, #IndustrialHemp, #KPUpdates, #CannabisPakistan, #LegalCannabis, #HealthcareReform",legalizes cannabis medical industrial purposes bloompakistan kpgovt cannabislegalization kpknews medicalcannabis industrialhemp kpupdates cannabispakistan legalcannabis healthcarereform full story annabisformedicalandindustrialpurposes,0.175,0.275,Positive
Eyup Yilmaz,Healthcare reforms are under scrutiny as the recent data reveals the widening gap in access and affordability. Ensuring equitable healthcare for all should be a top priority.  #HealthCareReform #EqualAccess #PublicHealth,"#HealthCareReform, #EqualAccess, #PublicHealth",healthcare reforms scrutiny recent data reveals widening gap access affordability ensuring equitable healthcare top priority healthcarereform equalaccess publichealth,0.25,0.375,Positive
Robert Morton,From spying to saving on premiums—this ex-CIA analyst traded covert ops for health insurance reform.   Who knew shaking up healthcare could be the real mission?  #CIA #CEO #HealthcareReform #ciaanalyst #CareerDevelopment #usa,"#CIA, #CEO, #HealthcareReform, #ciaanalyst, #CareerDevelopment, #usa",spying saving premiumsthis excia analyst traded covert ops health insurance reform knew shaking healthcare could real mission cia ceo healthcarereform ciaanalyst careerdevelopment usa,0.2,0.3,Positive
The Royal Australasian College of Physicians,"The RACP has released its 2025 Election Statement to support discussions with MPs, policymakers, and community leaders.  https:// ource/advocacy-library/2025-federal-election-statement-the-healthcare-australians-need.pdf?sfvrsn=3bcba41a_4 … #healthcarereform #auspol #auspol2025 #Medicare #TheRACP","#healthcarereform, #auspol, #auspol2025, #Medicare, #TheRACP",racp released election statement support discussions mps policymakers community leaders ourceadvocacylibraryfederalelectionstatementthehealthcareaustraliansneedpdfsfvrsnbcbaa healthcarereform auspol auspol medicare theracp,0.0,0.0,Neutral
Pharmacy Business,Exclusive: Abolishment of NHS England can “transform health services” #NHSReform #PharmacyBusiness #HealthcareReform #NHSChanges #PharmacyIndustry #HealthPolicy #PharmacyProfession,"#NHSReform, #PharmacyBusiness, #HealthcareReform, #NHSChanges, #PharmacyIndustry, #HealthPolicy, #PharmacyProfession",exclusive abolishment nhs england transform health services nhsreform pharmacybusiness healthcarereform nhschanges pharmacyindustry healthpolicy pharmacyprofession,0.0,0.0,Neutral
American Legislative Exchange Council,"With SB 95, Michigan joins a growing number of states passing bipartisan healthcare price transparency laws.  @BrooklynRoberts  highlights how this move could help patients make informed decisions and lowers costs. https:// -care-price-transparency-is-having-a-michigan-moment/ … #HealthcareReform #PriceTransparency","#HealthcareReform, #PriceTransparency",michigan joins growing number states passing bipartisan healthcare price transparency laws highlights move could help patients make informed decisions lowers costs carepricetransparencyishavingamichiganmoment healthcarereform pricetransparency,0.0,0.0,Neutral
Focus News,"हमारी स्वास्थ्य सेवा, शिक्षा प्रणालियां वस्तुकरण और व्यावसायीकरण से ग्रस्त हो रही हैं: धनखड़  #FocusNews #NationalNews #HealthCare #EducationSystem #Commercialization #PublicHealth #QualityEducation #SocialJustice #HealthcareReform #EducationalEquity","#FocusNews, #NationalNews, #HealthCare, #EducationSystem, #Commercialization, #PublicHealth, #QualityEducation, #SocialJustice, #HealthcareReform, #EducationalEquity",focusnews nationalnews healthcare educationsystem commercialization publichealth qualityeducation socialjustice healthcarereform educationalequity,0.0,0.0,Neutral
Eastern Eye,Starmer scraps NHS England to cut costs and improve care  #NHSReform #StarmerPlans #NHSChanges #HealthcareReform #CuttingCosts #ImprovingCare #NHSEngland,"#NHSReform, #StarmerPlans, #NHSChanges, #HealthcareReform, #CuttingCosts, #ImprovingCare, #NHSEngland",starmer scraps nhs england cut costs improve care nhsreform starmerplans nhschanges healthcarereform cuttingcosts improvingcare nhsengland,0.0,0.0,Neutral
Ritam English,"Ayushman Bharat rolls out in Delhi!

 ₹10 lakh health cover now a reality. Kejriwal delayed, Modi delivered-proof of  #ModiKiGuarantee #AyushmanBharat #Delhi #HealthcareReform #ModiDelivers #PMModi","#ModiKiGuarantee, #AyushmanBharat, #Delhi, #HealthcareReform, #ModiDelivers, #PMModi",ayushman bharat rolls delhi lakh health cover reality kejriwal delayed modi deliveredproof modikiguarantee ayushmanbharat delhi healthcarereform modidelivers pmmodi,0.0,0.0,Neutral
ETHealthWorld,Trump cuts could clash with Kennedy's long to-do list #USHealthPolicy  |  #MakeAmericaHealthyAgain  |  #PublicHealth  |  #ChronicIllness  |  #HealthcareReform  |  #VaccineResearch  |  #FoodSafety  |  #Telemedicine  |  #RuralHealthcare  |  #TrumpAdministration Read more: https:// trump-cuts-could-clash-with-kennedys-long-to-do-list/118263624 …,"#USHealthPolicy, #MakeAmericaHealthyAgain, #PublicHealth, #ChronicIllness, #HealthcareReform, #VaccineResearch, #FoodSafety, #Telemedicine, #RuralHealthcare, #TrumpAdministration",trump cuts could clash kennedys long todo list ushealthpolicy makeamericahealthyagain publichealth chronicillness healthcarereform vaccineresearch foodsafety telemedicine ruralhealthcare trumpadministration read trumpcutscouldclashwithkennedyslongtodolist,-0.05,0.4,Negative
Outlook Business,"JM Financial’s report noted that GenAI use cases are emerging across healthcare payers and providers to enhance patient care and improve operational efficiency.

Read more:  https:// #OutlookBusiness #GenAI #HealthcareReform","#OutlookBusiness, #GenAI, #HealthcareReform",financials report noted genai use cases emerging across healthcare payers providers enhance patient care improve operational efficiency read outlookbusiness genai healthcarereform,0.0,0.0,Neutral
Global Banking & Finance Review," A shocking case unfolds in France as surgeon Joel Le Scouarnec faces trial for the aggravated rape of 299 victims, many children. Despite a past child porn conviction, he continued working in hospitals.  #ChildAbuse #Justice #France #HealthcareReform","#ChildAbuse, #Justice, #France, #HealthcareReform",shocking case unfolds france surgeon joel scouarnec faces trial aggravated rape victims many children despite past child porn conviction continued working hospitals childabuse justice france healthcarereform,-0.25,0.5833333333333334,Negative
Elation Health," Primary care is key to tackling chronic disease & cutting costs.

Read more from Dr. Sara Pastoor  https:// #PrimaryCare #ChronicDisease #HealthcareReform #ElationHealth","#PrimaryCare, #ChronicDisease, #HealthcareReform, #ElationHealth",primary care key tackling chronic disease cutting costs read sara pastoor primarycare chronicdisease healthcarereform elationhealth,-0.0666666666666666,0.7999999999999999,Negative
•TSP Om,"Cannabis showing real promise for patients with cirrhosis—fewer complications, shorter stays, and lower costs. This isn’t anecdotal, it’s data. Time to take plant medicine seriously.  #CannabisIsMedicine #LiverHealth #HealthcareReform","#CannabisIsMedicine, #LiverHealth, #HealthcareReform",cannabis showing real promise patients cirrhosisfewer complications shorter stays lower costs isnt anecdotal data time take plant medicine seriously cannabisismedicine liverhealth healthcarereform,-0.0666666666666666,0.4833333333333333,Negative
ADITYA VIKRAM,"Jharkhand’s air ambulance service has proven to be a lifesaver, rescuing 94 people so far. A commendable initiative by the government that ensures critical patients receive timely medical care. Such efforts strengthen our healthcare system!  #Jharkhand #HealthcareReform ”","#Jharkhand, #HealthcareReform",jharkhands air ambulance service proven lifesaver rescuing people far commendable initiative government ensures critical patients receive timely medical care efforts strengthen healthcare system jharkhand healthcarereform,0.0333333333333333,0.6,Positive
NASHP,"Oregon’s smart hospital payment cap saved $112.7M—exceeding expectations! With 9 states considering similar legislation, Oregon’s success offers key lessons. Learn more https:// #HealthCareReform #StatePolicy #MedicareRates","#HealthCareReform, #StatePolicy, #MedicareRates",oregons smart hospital payment cap saved mexceeding expectations states considering similar legislation oregons success offers key lessons learn healthcarereform statepolicy medicarerates,0.1228571428571428,0.4085714285714285,Positive
Focus News,मोदी सरकार ने देश के स्वास्थ्य ढांचे को बेहतर बनाया: अमित शाह  #FocusNews #NationalNews #ModiGovernment #HealthInfrastructure #AmitShah #IndiaHealth #HealthcareReform #PublicHealth #HealthForAll #BetterHealthcare,"#FocusNews, #NationalNews, #ModiGovernment, #HealthInfrastructure, #AmitShah, #IndiaHealth, #HealthcareReform, #PublicHealth, #HealthForAll, #BetterHealthcare",focusnews nationalnews modigovernment healthinfrastructure amitshah indiahealth healthcarereform publichealth healthforall betterhealthcare,0.0,0.0,Neutral
