Username,Tweet,Hashtags,clean_tweet,polarity,subjectivity,sentiment
Outdoor Channel,"It's widely known that bass spawn in the spring but there's an old secret that they try again in the Fall, This episode truly is where reality becomes illusion and illusion becomes reality.

ZONA's Awesome Fishing Show!  /  ALL NEW SUNDAY AT 8:30 AM ET.  #FindYourAdventure",#FindYourAdventure,widely known bass spawn spring theres old secret try fall episode truly reality becomes illusion illusion becomes reality zonas awesome fishing show new sunday findyouradventure,0.0977272727272727,0.5424242424242424,Positive
Outdoor Channel,"Steve Pennaz and Elite Bass Pro Brandon Coulter target fall largemouth on lake with massive weed flats.

Lake Commandos  /  ALL NEW SUNDAY 11:30 AM ET.  #FindYourAdventure #fishing #fish #outdoors #bass #bassfishing #largemouth","#FindYourAdventure, #fishing, #fish, #outdoors, #bass, #bassfishing, #largemouth",steve pennaz elite bass pro brandon coulter target fall largemouth lake massive weed flats lake commandos new sunday findyouradventure fishing fish outdoors bass bassfishing largemouth,-0.0409090909090909,0.6136363636363636,Negative
Outdoor Channel,"Kevin VanDam fishes with Luke Bryan at his home lake and the giant bass were the star of the show.

The Vandam Experience  /  ALL NEW SUNDAY AT 8 AM ET.  #FindYourAdventure #fishing #outdoors #bass #bassfishing #lukebryan","#FindYourAdventure, #fishing, #outdoors, #bass, #bassfishing, #lukebryan",kevin vandam fishes luke bryan home lake giant bass star show vandam experience new sunday findyouradventure fishing outdoors bass bassfishing lukebryan,-0.0409090909090909,0.6136363636363636,Negative
Outdoor Channel,"Talk about a MAGNUM Moose!!! - Shared by @lancasters_nbo_nwto 

Is a giant moose on your bucket list?  #FindYourAdventure #hunting #outdoors #moose #moosehunting #bucketlist","#FindYourAdventure, #hunting, #outdoors, #moose, #moosehunting, #bucketlist",talk magnum moose shared giant moose bucket list findyouradventure hunting outdoors moose moosehunting bucketlist,0.0,1.0,Neutral
Google Cloud Tech reposted," I created a new video   that shows how to execute dbt pipelines with Airflow and Cloud Run   Run dbt pipelines on Cloud Run with CloudRunExecuteJobOperator  Use Cosmos Library to mirror dbt models in Airflow

Links in comments @GoogleCloudTech @getdbt @ApacheAirflow",,created new video shows execute dbt pipelines airflow cloud run run dbt pipelines cloud run cloudrunexecutejoboperator use cosmos library mirror dbt models airflow links comments,0.1363636363636363,0.4545454545454545,Positive
Google Cloud Tech,"NotebookLM is a great tool for creating audio overviews, but did you know you can generate audio with Google Cloud tools & have control over the tone, voice, & script?

Learn how to build and refine your audio generation end-to-end with Gemini 1.5 Pro ↓",,notebooklm great tool creating audio overviews know generate audio google cloud tools control tone voice script learn build refine audio generation endtoend gemini pro,0.8,0.75,Positive
Outdoor Channel,"Come on dad let me try!!! Be careful out there! 

DM for credit. 
•  #FindYourAdventure #hunting #outdoors #kid #kidswhohunt #gun #shotgun","#FindYourAdventure, #hunting, #outdoors, #kid, #kidswhohunt, #gun, #shotgun",come dad let try careful credit findyouradventure hunting outdoors kid kidswhohunt gun shotgun,-0.1,1.0,Negative
Outdoor Channel,Enjoy an in-depth look at some of the most massive 8-points ever to live via  @NAWhitetail :  https:// #FindYourAdventure #hunting #outdoors #deer #deerseason #deerhunting #whitetail,"#FindYourAdventure, #hunting, #outdoors, #deer, #deerseason, #deerhunting, #whitetail",enjoy indepth look massive points ever live via findyouradventure hunting outdoors deer deerseason deerhunting whitetail,0.1787878787878788,0.6666666666666666,Positive
Outdoor Channel,"Great shot!!! Submitted by Skopecam. 
• #FindYourAdventure #hunting #outdoors #deer #deerhunting #deerseason #whitetail #shooting","#FindYourAdventure, #hunting, #outdoors, #deer, #deerhunting, #deerseason, #whitetail, #shooting",great shot submitted skopecam findyouradventure hunting outdoors deer deerhunting deerseason whitetail shooting,0.8,0.75,Positive
Outdoor Channel,outdoorWatch the SHOT Show New Product Premiere on Outdoor Channel Saturday January 25th at 8P ET. Get a sneak peek at the hottest products this year's SHOT Show has to offer!  https://,,outdoorwatch shot show new product premiere outdoor channel saturday january get sneak peek hottest products years shot show offer,0.1363636363636363,0.4545454545454545,Positive
Outdoor Channel,How strong was your Christmas decorating game this year?  #FindYourAdventure #MerryChristmas #christmas #christmas2024 #christmasdecorations #christmaslights,"#FindYourAdventure, #MerryChristmas, #christmas, #christmas2024, #christmasdecorations, #christmaslights",strong christmas decorating game year findyouradventure merrychristmas christmas christmas christmasdecorations christmaslights,0.0166666666666666,0.5666666666666667,Positive
Outdoor Channel,'Tis the season to eat good food and be merry! Here are 10 amazing recipes for the Holiday season via  @GameAndFishMag :  https:// #FindYourAdventure #MerryChristmas #christmas #recipe #holiday #wildgame #holidayfood,"#FindYourAdventure, #MerryChristmas, #christmas, #recipe, #holiday, #wildgame, #holidayfood",tis season eat good food merry amazing recipes holiday season via findyouradventure merrychristmas christmas recipe holiday wildgame holidayfood,0.65,0.75,Positive
Outdoor Channel,"What's better than a head-to-head, single target competition? Nothing! Really nothing.

American Airgunner TV  /  TONIGHT AT 6:30 PM ET.  #FindYourAdventure #airgunnertv #outdoors #competition #challenge","#FindYourAdventure, #airgunnertv, #outdoors, #competition, #challenge",whats better headtohead single target competition nothing really nothing american airgunner tonight findyouradventure airgunnertv outdoors competition challenge,0.1571428571428571,0.2285714285714286,Positive
Outdoor Channel,Do you have enough buck mounts to pull Santa's sleigh? - Shared by Rackulator  #FindYourAdventure #MerryChristmas #christmas #christmastime #christmas2024 #deer #deermount,"#FindYourAdventure, #MerryChristmas, #christmas, #christmastime, #christmas2024, #deer, #deermount",enough buck mounts pull santas sleigh shared rackulator findyouradventure merrychristmas christmas christmastime christmas deer deermount,0.0,0.5,Neutral
Outdoor Channel,Merry Christmas from our family to yours!  #FindYourAdventure #MerryChristmas #christmas  #2024  #christmastime #hunting #fishing #outdoors #family,"#FindYourAdventure, #MerryChristmas, #christmas, #2024, #christmastime, #hunting, #fishing, #outdoors, #family",merry christmas family findyouradventure merrychristmas christmas christmastime hunting fishing outdoors family,0.0,0.0,Neutral
Outdoor Channel,"Such a cool idea for a Christmas Tree! - Shared by @mrmatchedset  

Do you have enough sheds to decorate your tree?  #FindYourAdventure #MerryChristmas #christmas #christmas2024 #christmastree #sheds","#FindYourAdventure, #MerryChristmas, #christmas, #christmas2024, #christmastree, #sheds",cool idea christmas tree shared enough sheds decorate tree findyouradventure merrychristmas christmas christmas christmastree sheds,0.175,0.575,Positive
Outdoor Channel,"When Jordan Schwarck acquired new dirt in September, he never dreamed he'd fill his first tag on the property with a buck that measured 198 inches. Full story via  @NAWhitetail :  https:// #FindYourAdventure #hunting #outdoors #deer #deerseason #deerhunting","#FindYourAdventure, #hunting, #outdoors, #deer, #deerseason, #deerhunting",jordan schwarck acquired new dirt september never dreamed hed fill first tag property buck measured inches full story via findyouradventure hunting outdoors deer deerseason deerhunting,0.2454545454545454,0.4459595959595959,Positive
Outdoor Channel,“The Fowl Life” host Chad Belding gives us the goods on his preferred gear for all things waterfowl. Here's the goods via  @GameAndFishMag :  https:// #FindYourAdventure #hunting #outdoors #waterfowl #waterfowlhunting #clothing,"#FindYourAdventure, #hunting, #outdoors, #waterfowl, #waterfowlhunting, #clothing",fowl life host chad belding gives goods preferred gear things waterfowl heres goods via findyouradventure hunting outdoors waterfowl waterfowlhunting clothing,0.0,0.0,Neutral
Outdoor Channel,"Chris Dorsey hunts the rugged mountains of New Zealand with old friend John Scurr.

Sporting Classics TV with Chris Dorsey  /  SUNDAY AT 10:30 AM ET.  #FindYourAdventure #hunting #outdoors #NewZealand #mountains #hunt","#FindYourAdventure, #hunting, #outdoors, #NewZealand, #mountains, #hunt",chris dorsey hunts rugged mountains new zealand old friend john scurr sporting classics chris dorsey sunday findyouradventure hunting outdoors newzealand mountains hunt,0.1181818181818181,0.3272727272727272,Positive
Outdoor Channel,"After months of hard work, misfortune in the field and tested patience, it all comes together for Team Drop Zone.

Team Drop Zone TV  /  SUNDAY AT 11 AM ET.  #FindYourAdventure #hunting #outdoors #Kansas #deer #deerseason #deerhunting #whitetail","#FindYourAdventure, #hunting, #outdoors, #Kansas, #deer, #deerseason, #deerhunting, #whitetail",months hard work misfortune field tested patience comes together team drop zone team drop zone sunday findyouradventure hunting outdoors kansas deer deerseason deerhunting whitetail,-0.2916666666666667,0.5416666666666666,Negative
Outdoor Channel,Make holiday shopping easy this year with the MyOutdoorTV Pick Your Present Holiday Sale!  https://,,make holiday shopping easy year myoutdoortv pick present holiday sale,0.2166666666666666,0.4166666666666667,Positive
Outdoor Channel,Congratulations to Nick Mundt from Michael Waddell's Bone Collector who had one bitter cold week in Alberta that was hugely successful!  #FindYourAdventure #outdoors #hunting #deer #deerseason #deerhunting #alberta #muledeer,"#FindYourAdventure, #outdoors, #hunting, #deer, #deerseason, #deerhunting, #alberta, #muledeer",congratulations nick mundt michael waddells bone collector one bitter cold week alberta hugely successful findyouradventure outdoors hunting deer deerseason deerhunting alberta muledeer,0.0166666666666666,0.8166666666666668,Positive
Google for Developers,An AI research assistant for everyone.,,research assistant everyone,0.0,0.0,Neutral
Google for Developers,This is exactly the kind of feedback we need! Keep the ideas coming on how Gemini can be more helpful for everyone.,,exactly kind feedback need keep ideas coming gemini helpful everyone,0.6,0.9,Positive
Google for Developers reposted,"Get a sneak peek into  #DevFest  Lagos with Tobiloba Adedeji!  From gearing up to delivering an inspiring talk on “Using Semantic Caching to Optimize LLMs,”  @toby_solutions ’ journey captures the energy of the day.

Join  #DevFest  →  http://","#DevFest, #DevFest",get sneak peek devfest lagos tobiloba adedeji gearing delivering inspiring talk using semantic caching optimize llms journey captures energy day join devfest,0.5,1.0,Positive
Google for Developers," Missed the Women in AI Summit 2024?  

Catch up on the sessions to expand your AI skills and learn to build with Gemini APIs, Google AI Studio, Gemma, and more! →  https://",,missed women summit catch sessions expand skills learn build gemini apis google studio gemma,0.0,0.0,Neutral
Google Cloud Tech,"Join Googler Wietse Venema for a deep dive into fine-tuning open models using Hugging Face Transformer Reinforcement Learning (TRL) using GKE.

TRL is an  #OpenSource  library that provides all the tools you need to train LLMs, developed by  @huggingface  ↓",#OpenSource,join googler wietse venema deep dive finetuning open models using hugging face transformer reinforcement learning trl using gke trl opensource library provides tools need train llms developed,0.0333333333333333,0.3999999999999999,Positive
Outdoor Channel,"Congratulations to Dallas Birk for putting down this absolute GIANT whitetail from Kansas! The deer has 31 scorable points equaling 255 inches, and is one of the most impressive deer we've seen this season! -  @Buckmasters #FindYourAdventure #hunting #outdoors #deer #deerhunting","#FindYourAdventure, #hunting, #outdoors, #deer, #deerhunting",congratulations dallas birk putting absolute giant whitetail kansas deer scorable points equaling inches one impressive deer weve seen season findyouradventure hunting outdoors deer deerhunting,0.3999999999999999,0.9666666666666668,Positive
Google for Developers reposted,"Build intelligent experiences for your iOS app with Gemini  Learn how to use the native Vertex AI in Firebase SDK to:  Make calls to Gemini  Construct a chat  Run inference on files stored in Firebase Storage 

Watch  #FirebaseDemoDay  →  http://",#FirebaseDemoDay,build intelligent experiences ios app gemini learn use native vertex firebase sdk make calls gemini construct chat run inference files stored firebase storage watch firebasedemoday,0.8,0.9,Positive
Outdoor Channel,"Join us in prayers for Duck Dynasty patriarch Phil Robertson and all of the Robertson family.   

As you have probably heard, Phil Robertson, the founder of Duck Commander has been diagnosed with Alzheimer's disease. We are grateful for all that Phil has contributed to",,join prayers duck dynasty patriarch phil robertson robertson family probably heard phil robertson founder duck commander diagnosed alzheimers disease grateful phil contributed,0.0,0.0,Neutral
Google,5 ways to simplify holiday planning with Gemini ↓,,ways simplify holiday planning gemini,0.0,0.0,Neutral
Google Cloud Tech,"We announced new features for Google Cloud Backup and DR service in September—and now they're GA!

Protect production data from cyber attacks and accidental loss with backup vaults, and leverage the new capabilities to simplify Compute Engine VM backups →  https://",,announced new features google cloud backup service septemberand theyre protect production data cyber attacks accidental loss backup vaults leverage new capabilities simplify compute engine backups,0.1363636363636363,0.4545454545454545,Positive
Outdoor Channel,"""This buck is one of those deer that feels like one of those ""meant to be"" kinda things."" 

Help us congratulate our buddy Nick's Wild Ride on his great buck!  #FindYourAdventure #hunting #outdoors #deer #deerseason #deerhunting #whitetail","#FindYourAdventure, #hunting, #outdoors, #deer, #deerseason, #deerhunting, #whitetail",buck one deer feels like one meant kinda things help congratulate buddy nicks wild ride great buck findyouradventure hunting outdoors deer deerseason deerhunting whitetail,0.45,0.575,Positive
Google Cloud Tech,"Ready to see tangible business value from  #generativeAI ? Grounding is key! 

Vertex AI empowers your LLMs with real-world data for improved accuracy, enhanced customer service, and deeper insights →  https://",#generativeAI,ready see tangible business value generativeai grounding key vertex empowers llms realworld data improved accuracy enhanced customer service deeper insights,0.1,0.75,Positive
Outdoor Channel,"Once official, Tony Newman's 190-inch Ohio buck will easily find a place in the Buckeye State's record book. He'll join brother Tim, who currently holds the state firearms record for whitetails. Full story via  @NAWhitetail :  https:// #FindYourAdventure #hunting","#FindYourAdventure, #hunting",official tony newmans inch ohio buck easily find place buckeye states record book hell join brother tim currently holds state firearms record whitetails full story via findyouradventure hunting,0.2611111111111111,0.5944444444444444,Positive
Google reposted,"Developing Inala was a labor of love for CEO & founder  @lala . See how she and her team use the Google Pixel ecosystem to stay in control of their day-to-day business needs, social media, and collaboration from the palm of their hands:  https://",,developing inala labor love ceo founder see team use google pixel ecosystem stay control daytoday business needs social media collaboration palm hands,0.2666666666666666,0.3333333333333333,Positive
Google for Developers," The Women in AI Summit 2024 is only a day away! 

Uncover four crucial skills to AI success with  @jocarrasqueira  & integrate them into your career. Be inspired by leaders in the industry & get the tools to uplevel your AI knowledge. 

Register →  https://",,women summit day away uncover four crucial skills success integrate career inspired leaders industry get tools uplevel knowledge register,0.15,0.5,Positive
Google Cloud Tech,"Jump Start Solution: AI/ML image processing on Cloud Functions →  https:// Deploying this solution creates an image processing service that can help you:
- Handle unsafe UGC
- Digitize text from physical docs
- Detect and classify objects in images
- & more!",,jump start solution aiml image processing cloud functions deploying solution creates image processing service help handle unsafe ugc digitize text physical docs detect classify objects images,0.0,0.1428571428571428,Neutral
Outdoor Channel,Hunting the rut can be both wonderful and maddening. Here's how to master the whitetail rut via  @GameAndFishMag :  https:// #FindYourAdventure #hunting #outdoors #deer #deerseason #deerhunting #whitetail #whitetailrut,"#FindYourAdventure, #hunting, #outdoors, #deer, #deerseason, #deerhunting, #whitetail, #whitetailrut",hunting rut wonderful maddening heres master whitetail rut via findyouradventure hunting outdoors deer deerseason deerhunting whitetail whitetailrut,1.0,1.0,Positive
Google,something is not the same ,,something,0.0,0.0,Neutral
Google for Developers,"Google AI Edge LiteRT brings the power of machine learning to your mobile devices  This open-source framework allows you to run optimized models on-device for tasks like image classification, object detection, reinforcement learning, and more →  https://",,google edge litert brings power machine learning mobile devices opensource framework allows run optimized models ondevice tasks like image classification object detection reinforcement learning,0.0,0.0,Neutral
Google Cloud Tech,"When faced with a new, unfamiliar table, you may not know where to begin. Use data insights in Gemini in BigQuery to generate insightful questions (and the SQL queries to answer them!) with the click of a button →  https://",,faced new unfamiliar table may know begin use data insights gemini bigquery generate insightful questions sql queries answer click button,0.1363636363636363,0.4545454545454545,Positive
Outdoor Channel,We are pleased to present Pale Rider TONIGHT at 10 PM ET. A mysterious preacher protects a humble prospector village from a greedy mining company trying to encroach on their land.  #FindYourAdventure #western #westernmovie #village #cowboy #west #outdoors,"#FindYourAdventure, #western, #westernmovie, #village, #cowboy, #west, #outdoors",pleased present pale rider tonight mysterious preacher protects humble prospector village greedy mining company trying encroach land findyouradventure western westernmovie village cowboy west outdoors,0.015,0.4299999999999999,Positive
Google,Check out some of the biggest shows and movies on Google TV this year ↓,,check biggest shows movies google year,0.0,0.0,Neutral
Outdoor Channel,"On the volcanic Umnak Island, Pat and Connie Harvie must come face-to-face with their feral herd as they go in search of the perfect spot for a satellite corral. Charlie Summerville and his family may have won the battle with their cabin on Volcano Bay, but have they lost the war",,volcanic umnak island pat connie harvie must come facetoface feral herd search perfect spot satellite corral charlie summerville family may battle cabin volcano bay lost war,1.0,1.0,Positive
Google for Developers,Streamline your Google Pay integration with Project IDX.   Get your web project running in just minutes — perfect for devs looking to save time and focus on innovation. Try it now →  https://,,streamline google pay integration project idx get web project running minutes perfect devs looking save time focus innovation try,1.0,1.0,Positive
Google reposted,"Founder of  @TheNourishSpot  Dawn Kelly believes in the power of collaboration & building a resilient business.

See what her business offers  http:// , then share one thing that's helped your Black-owned business thrive #GrowWithGoogle #BlackOwnedFriday","#GrowWithGoogle, #BlackOwnedFriday",founder dawn kelly believes power collaboration building resilient business see business offers share one thing thats helped blackowned business thrive growwithgoogle blackownedfriday,0.1,0.0,Positive
Google Cloud Tech,"That's a wrap on  #KubeCon  +  #CloudNativeCon  2024 and the last KubeCon event of the year! 

Check out these sessions from our very own Googlers at  #KubeCon  +  #CloudNativeCon  2024—available on demand ↓","#KubeCon, #CloudNativeCon, #KubeCon, #CloudNativeCon",thats wrap kubecon cloudnativecon last kubecon event year check sessions googlers kubecon cloudnativecon available demand,0.2,0.2333333333333333,Positive
Google Cloud Tech,"#2: Contributing to Kubernetes in Its Second Decade—SIG ContribEx Style with Kaslin Fields, Priyanka Saggu, Madhav Jivrajani, and Nabarun Pal ",#2,contributing kubernetes second decadesig contribex style kaslin fields priyanka saggu madhav jivrajani nabarun pal,0.0,0.0,Neutral
Google Cloud Tech,"#3: Making Kubernetes Simpler for Accelerated Workloads with Susan Wu, Lucy Sweet, Mitch McKenzie, Aditya Shanker, and Rebecca Weekly ",#3,making kubernetes simpler accelerated workloads susan lucy sweet mitch mckenzie aditya shanker rebecca weekly,0.35,0.65,Positive
Google for Developers," Discover how AI can help solve humanity’s great challenges at the Women in AI Summit 2024!  @GoogleDeepMind ’s Kathleen Kenealy shares how Gemma’s family of open models empowers devs to build the future, regardless of hardware or location.

Register →  https://",,discover help solve humanitys great challenges women summit kathleen kenealy shares gemmas family open models empowers devs build future regardless hardware location register,0.2666666666666666,0.4583333333333333,Positive
Google reposted,"In honor of Native American Heritage Month, today’s  #GoogleDoodle  celebrates kayaks which were invented by Arctic tribes 5,000 years ago. 

Learn more about the origin story →  https://",#GoogleDoodle,honor native american heritage month todays googledoodle celebrates kayaks invented arctic tribes years ago learn origin story,0.0,0.0,Neutral
Google for Developers,Connecting an AI Studio project with Google Colab just got easier,,connecting studio project google colab got easier,0.0,0.0,Neutral
Outdoor Channel,Our deer experts report on current deer movement and patterns and what areas can expect the rut to be kicking off via  @GameAndFishMag :  https:// #FindYourAdventure #hunting #outdoors #therut #deer #deerseason #deerrut,"#FindYourAdventure, #hunting, #outdoors, #therut, #deer, #deerseason, #deerrut",deer experts report current deer movement patterns areas expect rut kicking via findyouradventure hunting outdoors therut deer deerseason deerrut,0.0,0.4,Neutral
Google Cloud Tech reposted,I'm an AI-skeptic but we recently integrated Vertex AI into our product Konfigurate to automate the creation of IaC. Prompt engineering really isn't a meme when you get access to 1M+ token context windows with near-perfect recall.  https:// nfrastructure-as-code …,,aiskeptic recently integrated vertex product konfigurate automate creation iac prompt engineering really isnt meme get access token context windows nearperfect recall nfrastructureascode,0.1,0.225,Positive
Google for Developers," We teamed up with  @Sourcegraph , the creators of Cody AI, to see how long context improves their AI coding assistance.

Cody's performance with Gemini 1.5 Flash's 1M context window saw improvements across key benchmarks.

Explore the results →  https://",,teamed creators cody see long context improves coding assistance codys performance gemini flashs context window saw improvements across key benchmarks explore results,-0.025,0.7,Negative
Outdoor Channel,"Grant Kuypers has us on the birds again at Buck Paradise.

The Fowl Life with Chad Belding  /  SATURDAY AT 8 AM ET.  #FindYourAdventure #hunting #outdoors #wildfowl #waterfowl #duckhunting","#FindYourAdventure, #hunting, #outdoors, #wildfowl, #waterfowl, #duckhunting",grant kuypers birds buck paradise fowl life chad belding saturday findyouradventure hunting outdoors wildfowl waterfowl duckhunting,0.0,0.0,Neutral
Outdoor Channel,"If you haven't heard of DECKED, you soon will. This is the story of one of the fastest growing and most dynamic businesses in the USA.

American Made  /  ALL NEW FRIDAY AT 8 PM ET.  #FindYourAdventure #American #made #decked #truck #storage #truckbedstorage #getdecked","#FindYourAdventure, #American, #made, #decked, #truck, #storage, #truckbedstorage, #getdecked",havent heard decked soon story one fastest growing dynamic businesses usa american made new friday findyouradventure american made decked truck storage truckbedstorage getdecked,0.034090909090909,0.1553030303030303,Positive
Go, Go 1.23.3 and 1.22.9 are released!  Announcement:  https:// nce/c/X5KodEJYuqI …  Download:  https:// #golang,#golang,released announcement ncecxkodejyuqi download golang,0.0,0.0,Neutral
